timestamp,tweet_text,username,all_hashtags,followers_count,,Primary,Secondary
7/9/19 4:06,b'@JenHogben i have looked at social housing the system used in stated build to rent all that rubish and its a rort as developers dont want low-income tenants over time its become a rort one of ways trump made money its a way to steal public housing dollar',b'indica2007',[],3047,,C,EA
7/9/19 3:59,b'Seize all golf courses without compensation and turn them into ecologically friendly green public housing with plenty of space for parks and open recreational areas tbh',b'Natcromancer',[],242,,IR,F
7/9/19 3:59,b'@LukeHowarthMP I would prefer Services for all reather than tax cuts for some. You could have postponed the tax cuts and funded public housing- which saves $$$ by reduced expenditure on legal &amp; health services https://t.co/2SNHw98erH',b'SisterOMalley',[],699,,C,EA
7/9/19 3:56,"b'@samhainous @BethLynch2020 @mistymtnreverie Listen... I don\xe2\x80\x99t know if you know, but, Public housing has some of the WORST living conditions in the country. That\xe2\x80\x99s the fact of it. Again... this idea that a fine will help government housing and landlords find their  better Angels... I repeat, the border reflects the truth.'",b'conduitofhealin',[],1015,,C,EA
7/9/19 3:55,"b'@slpng_giants_oz I live in his electorate. We have homeless people being moved on by council, they have no where to go . He sprouts on about the millions the LNP and the state government have given for a sporting venue in his electorate how about a little of that for public housing.'",b'PatriciaBalchi2',[],14,,PD,EA
7/9/19 3:51,"b""@conduitofhealin @BethLynch2020 @mistymtnreverie Ok, I'm emotional and you're emotionless. That make you feel superior?  A realistic approach is simple. Fine the people that break the laws. Put those fines into public housing. Not only will the landlords lose money via fines, they'll lose possible tenants to cheaper housing.""",b'samhainous',[],38,,C,F
7/9/19 3:49,b'Do foreign comrades know that Chinese Communist ibankers controlling HKSAR gov abolished rent control n privatized public housing\xe2\x80\x99s shopping centres? They must be mindfucked by the fact British colonists were more socialist then Chinese comrades #Hongkong  https://t.co/Djoa9tV39g',b'Badcanto',['Hongkong'],979,,IR,N
7/9/19 3:49,b'@JenHogben yer mum always called this house a council house i like that system letting councils run local public housing ... as its more local',b'indica2007',[],3047,,C,N