timestamp,tweet_text,username,all_hashtags,followers_count,,Primary,Secondary
7/9/19 17:42,"b'@drschweitzer @keynesianr @ShaneDPhillips @elpaavo @mc_lens @DanImmergluck Good to look at these things holistically, but largest public housing authority NYCHA spends 2x what private landlords do on opex, and the buildings are still poisoning kids with lead at higher rates than private housing. The inefficiency seems like a real problem'",b'MarketUrbanism',[],27724,,C,F
7/9/19 17:42,"b'One leader does not transform our nation. @janeosanders visits everyday heroes of SF Chinatown- Lee who led nation\xe2\x80\x99s 1st public housing rent strike in 1978 +families who live in 6x10 unit organizing for affordable homes. Join us- it\xe2\x80\x99s not just a campaign, it\xe2\x80\x99s a movement #NotMeUS https://t.co/uLeYemVNVk'",b'JaneKim',['NotMeUS'],31879,,C,S
7/9/19 17:40,"b'Let\xe2\x80\x99s worry @SDG2030,it\xe2\x80\x99s in plain view can\xe2\x80\x99t b hidden behind a finger:violence of all types, hunger,poor public housing cost  higher bad conditions,high percentage older people world over in poverty,no health services:2 trillionaires+12 men globalNorth own what 3 1/2 billion own'",b'benavides_marta',[],603,,C,F
7/9/19 17:40,"b'Let\xe2\x80\x99s worry @SDG2030,it\xe2\x80\x99s in plain view can\xe2\x80\x99t b hidden behind a finger:violence of all types, hunger,poor public housing cost  higher bad conditions,high percentage older people world over in poverty,no health services:2 trillionaires+12 men globalNorth own what 3 1/2 billion own https://t.co/SQX5HcOy3T'",b'benavides_marta',[],603,,C,F
7/9/19 17:40,"b'@globalcompact @UN @GlobalGoalsUN @UNDESA Let\xe2\x80\x99s worry @SDG2030,it\xe2\x80\x99s in plain view can\xe2\x80\x99t b hidden behind a finger:violence of all types, hunger,poor public housing cost  higher bad conditions,high percentage older people world over in poverty,no health services:2 trillionaires+12 men globalNorth own what 3 1/2 billion own'",b'benavides_marta',[],603,,C,F
7/9/19 17:35,"b'@AOC Humanitarian crisis your party created, by denying there was a crisis at the boarder in the first place. Denying funding for a wall and increased security. And WTH does public housing have to do with it.'",b'SandyTrombly',[],25,,C,EA
7/9/19 17:29,"b'@ShaneDPhillips @drschweitzer @elpaavo @mc_lens @DanImmergluck This is going to be an unpopular opinion here, but to me the evidence is that public housing is very inefficient (by that I mean only a fraction--perhaps 50 percent--of the subsidy winds up helping people).  The literature on this is, however, pretty old, and needs revisiting.'",b'keynesianr',[],2015,,C,F
7/9/19 17:26,b'\xf0\x9f\x9a\xa8TODAY\xf0\x9f\x9a\xa8 is the last day to submit comments on the proposed #HUD regulation that will harm mixed-status #immigrant families living in public housing!  #bioethics #publichealth https://t.co/V4Ic1VCFTo',b'faBioethics',"['HUD', 'immigrant', 'bioethics', 'publichealth']",707,,C,N
7/9/19 17:26,b'@amosilly @Wrlds4mostXpert @realDonaldTrFan Put before homeless people on the streets. There taking up public housing.',b'TheGentleDonN',[],5,,C,F
7/9/19 17:19,"b""Correct, though very important note many centerist Dems also participate in underfunding public housing, healtcare, but there's always enough money for a war. https://t.co/QvoYmcnCTm""",b'eee_eff',[],1744,,C,F
7/9/19 17:17,"b""I'm Banned From Every Strip Club &amp; Public Housing In The City \xf0\x9f\x96\x95\xf0\x9f\x8f\xbe 12 \xf0\x9f\x98\x9c""",b'RealBossLadyTee',[],13,,IR,N
7/9/19 17:15,"b'@ShaneDPhillips @mc_lens @keynesianr @elpaavo @DanImmergluck What Michael said but with public housing in high amenity locations, different permitting process in minority neighborhoods.'",b'drschweitzer',[],5212,,C,N
7/9/19 17:02,"b'Last day to comment on the proposed HUD rule prohibiting \xe2\x80\x9cmixed-status"" families in public housing/Section 8 programs. This is simply a harmful &amp; cruel rule that could evict over 100,000 people and cause long-lasting harm. https://t.co/J1YpuUxrCJ  #KeepFamiliesTogether'",b'dcmdjfon',['KeepFamiliesTogether'],26,,PD,EA
7/9/19 17:02,b'There\xe2\x80\x99s also a really unfortunate NIMBY strain in SF despite its reputation as a progressive city. Everyone says we should support the homeless - nobody wants to build public housing or homeless shelters in their neighborhood',b'being_ulti',[],4153,,C,F
7/9/19 17:02,"b'\xe2\x80\x9cI have a home, and I want the same for everyone else in this country\xe2\x80\x9d \xe2\x80\x93 Prime Minister Roosevelt Skerrit  CBI was vital in Dominica\xe2\x80\x99s recovery \xe2\x80\x93 particularly in its public housing sector: https://t.co/Yey8JtOWlH'",b'CSGlobalPtnrs',[],3148,,E,F
7/9/19 17:02,b'Demolishing public housing in Wellston may be put on hold by St. Louis County Executive https://t.co/pXgeYPbpkT',b'stltoday',[],248451,,N,N
7/9/19 17:01,b'How are we feeling about this? https://t.co/MY7zvv7Jhk',b'michaelsilliman',[],365,,Q,C
7/9/19 17:01,"b'UnidosUS Affiliate @sc4housing ""lucha por la familia"" and that\'s why they oppose the @HUDgov rule prohibiting mixed-status families from living in public housing. ""We are concerned about the number of families that may be impacted at @theCHAtweets."" https://t.co/jf96yJjFJT'",b'WeAreUnidosUS',[],74907,,C,EA
7/9/19 17:00,"b'#TIMEFRAMED #AUDIOBOOK SNEAK PEEK Listen as a Security Official in 2052 goes to a Public Housing Area, reserved for ""dregs"" of society, to interview a drug addict about a missing person. Win a Free Copy Click Here  @philinthebooth https://t.co/JohBEW0pyN https://t.co/QNjU3kbFEp'",b'TimeFramedBook',"['TIMEFRAMED', 'AUDIOBOOK']",385,,N,N
7/9/19 16:55,b'@AndrewGiambrone 7000 of the city\xe2\x80\x99s 8000 public housing units are in severe need of repair. Tell @marycheh to shut up and worry about that.',b'JaVonniBrustow',[],88577,,M,F
7/9/19 16:54,b'@AletheiaAtheos What about what\xe2\x80\x99s there now? Do you just take away existing public housing? In my area a private market 1 bedroom is close to $2k a month. In some areas it\xe2\x80\x99s $500 a month. Do you see the issue?',b'DesireeCPO30',[],389,,E,F
7/9/19 16:34,b'@kaitlancollins Sounds like he was given free public housing...',b'harmlesslurker',[],4,,IR,F
7/9/19 16:33,"b'I think a lot of it has to do with the density, public housing (NY has 400k units and SF has 3k), affordability, and the subway connecting residential neighborhoods and commercial areas that mean service industry workers can actually live nearby work instead of hours away'",b'being_ulti',[],4153,,C,N
7/9/19 16:30,"b'Thankful &amp; proud of the powerful Affiliate Network we have! TY @HispanicUnity, @MHDCCA, &amp; @NewEco4Women for joining our many other Affiliates opposing the @HUDgov rule that would prohibit mixed-status families from living in public housing. Comment now: https://t.co/jf96yJjFJT'",b'WeAreUnidosUS',[],74907,,N,S
7/9/19 16:29,"b'New York, the most \xe2\x80\x9cprogressive\xe2\x80\x9d city in the country, where lead-infused public housing crumbles, where communities are displaced with enthusiastic abandon, building four jails for the price of ten, bikers can\xe2\x80\x99t get a damn lane, cops at every subway station over $2.75  I\xe2\x80\x99m tired.'",b'VoltaireLaFlare',[],4975,,C,EA
7/9/19 16:25,b'@AOC Alexandria.... instead of asking for a raise ... you should go live in public housing',b'Luka79557413',[],0,,C,F
7/9/19 16:24,b'@HispanicCaucus @CBP Hispanic Caucus is fighting Ben Carson to keep illegals in public housing whilst 500000 Americans are homeless.   Hispanic Caucuse hates Americans https://t.co/k4qZM9jBiG',b'InnerStrumpf',[],1833,,C,N
7/9/19 16:16,b'@AOC Fuck public housing. These leaches don\xe2\x80\x99t deserve tax money to get the things for free people work hard to have.',b'JEgnor',[],3,,C,EA
7/9/19 16:12,"b'The demolition plan has been in the works since last year, and it\xe2\x80\x99s one that Page said is in line with federal policy under President Donald Trump\xe2\x80\x99s administration to \xe2\x80\x9cget out of the public housing business and just give people a voucher.\xe2\x80\x9d https://t.co/seaIVIZoRp'",b'kelseylandis',[],621,,N,N
7/9/19 16:05,"b'.@HUDgov proposed separating immigrant families in public housing. The mission of the agency I lead is to strengthen communities - this would do the opposite, increasing #homelessness &amp; plunging families into crisis. @SecretaryCarson should reconsider. https://t.co/lldiD54Fk7 https://t.co/mV08nGxldW'",b'WAComDirector',['homelessness'],609,,C,F
7/9/19 16:04,"b""@Pravduh15 @AOC Because, after proving how ineffective NY's government is at managing financial resources for their so-called public housing programs, what they absolutely need is more money to squander. Because that's how you retards want to solve every problem: throw MORE public money at it.""",b'fmoral3s16',[],57,,C,EA
7/9/19 16:01,"b'@SenJohnKennedy Past time for those executives to \xe2\x80\x9ctrickle down\xe2\x80\x9dsome of their compensation packages to the workers of Louisiana....maybe we can get these corporations to pay back the supplementary food stamps,  Medicaid, public housing &amp; other federal assistance applied to workers just to live'",b'Iamgood_man',[],940,,C,F
7/9/19 16:00,"b'\xe2\x80\x9cMany #prosecutors think it\xe2\x80\x99s not their job to worry about the consequences of a conviction beyond the sentence they ask for. But convictions have all kinds of ripple effects: the loss of a job, university admission, professional license, custody of a child, or public housing.\xe2\x80\x9d https://t.co/CJTBTParlz'",b'MelanieBatesLLC',['prosecutors'],182,,C,EA
7/9/19 16:00,"b'35 years after fleeing a war-torn Lebanon with her family, Hoda Nahlous has been made a partner at consulting giant @KPMG. @edmundtadros reports. #bigfour https://t.co/azaJ7WZfIl'",b'FinancialReview',['bigfour'],288822,,IR,N
7/9/19 15:59,"b""@Public_Citizen @AOC Um, I dont think that mold in Queens public housing is from the climate. Nor lead in drinking water. It's from bad management of these citys.""",b'forgedinvodka',[],35,,M,EA
7/9/19 15:56,"b'@3_spooked_5_me @conduitofhealin @DougHageman @BethLynch2020 @mistymtnreverie *public housing* is leftist policy, negotiating with realtors and landlords (as CA Dems are currently doing) is center-right controlled opposition policy'",b'pointblaek',[],527,,C,EA
7/9/19 15:54,"b""@SKMorefield @dbongino @realDonaldTrump @JoeTalkShow @NickAdamsinUSA @DailyCaller The Free loaders Dumocraps don't buy at Home Depot because they live in Public Housing!""",b'MauricioJoseL10',[],26,,C,EA
7/9/19 15:50,"b'Seoul mayor pledges more public housing for newlyweds,\xc2\xa0youth https://t.co/Mh93sIXuRR https://t.co/GUR5ppzDRO'",b'TimesEurope',[],105,,IR,S
7/9/19 15:46,b'@fuelgrannie @Mezikenyc @shaunking @CabanForQueens I never criticized your appearance. I criticized Caban campaign for transporting others into to a black community in the middle of public housing and ignoring them.',b'msbusylady',[],441,,C,EA
7/9/19 15:39,"b'@Loud_Lass Of course, public housing is anathema to them, they would leave everything to their so called free market if they could-their would be no public anything.'",b'DerekRobinson2',[],1050,,C,F
7/9/19 15:35,b'One last chance to post your comment opposing HUD policy that would separate families with an undocumented member from public housing. Hit the link. #affordablehousing #KeepFamiliesTogether https://t.co/fsjqnRmC2X',b'CynthiaDBond',"['affordablehousing', 'KeepFamiliesTogether']",830,,N,N
7/9/19 15:30,"b""@formambuh @AOC I'll talk to you when you get the bill for the new green deal as your walking to the bread line from your free public housing unit.""",b'jeffrey022889',[],31,,PD,EA
7/9/19 15:30,"b'With its properties home to approximately 400,000 residents, NYCHA operates the nation\xe2\x80\x99s largest public-housing program, but its physical stock and finances need serious repair. https://t.co/6OYZXKP37b https://t.co/FT9azE40dz'",b'TheBeatMI',[],7585,,M,N
7/9/19 15:20,b'@_michaelbrooks Didn\xe2\x80\x99t her husband organize against public housing? Something reprehensible like that.',b'cisco8oona',[],15,,IR,EA
7/9/19 15:19,"b""She's just mad because a New York Billionaire, kicked her out of public housing. Michelle Obama: Still whining about Trump\xe2\x80\x99s inauguration https://t.co/Bki2a0duWz""",b'Steve03513632',[],15,,C,EA
7/9/19 15:18,b'@Think1_1981 @IamJohnBurnett @angelvanstark @MJtheProphet @AOC My point is real simple- Continue funding mismanagement and you\xe2\x80\x99ll just get more mismanagement. They need to overhaul the entire public housing in NYCHA because the poorest of our children are suffering the most.',b'pd21590',[],294,,C,F
7/9/19 15:15,"b""St. Louis County executive says he's considering blocking the demolition of Wellston public housing https://t.co/UnokqSpeDi""",b'timyataw',[],75,,N,N
7/9/19 15:15,b'Today HUD announced $150 Million in Mainstream Vouchers. The funding will be awarded to public housing agencies to support vouchers that provide sustained community-based integrated housing opportunities to non-elderly people with disabilities. https://t.co/e6DXaU4OQn.',b'eitasjacksonco',[],68,,N,N
7/9/19 15:11,"b'@GloomyBrown @AOC @RudyGiuliani @BilldeBlasio ""NYCHA is in a crisis bc over YEARS of GOP majorities, they refused to fund basic maintenance of public housing to sabatoge it""   do you think economies or policies turn on a dime? NYC was run by republicans for 20 plus years before deblasio'",b'Urban_Avenger_',[],34,,Q,F
7/9/19 15:08,"b""@SteveScalise food stamps to make ends meet. The bill called for large employers like Amazon and Walmart to reimburse the government for food stamps, public housing, Medicaid and other federal assistance received by their workers. In response, Bezos raised Amazon workers' wages to $15 an hour.""",b'Iamgood_man',[],940,,PD,S
7/9/19 15:07,b'@lubiephil @abcnews Here\xe2\x80\x99s a positive spin for the MuPpet : get off yer arse and make it go away. Invest in public housing nationally. Increase Newstart etc. How\xe2\x80\x99s them for positives?',b'RobynInTheStix',[],281,,Q,F
7/9/19 15:04,"b'Between 2010-2017, #NYCHA challenged 95% of the positive lead inspections carried out by Health Department. Now, @BilldeBlasio is promising more inspections. We must hold the city accountable to tenants living in public housing! #TenantTuesday   https://t.co/yOn55fQvbU'",b'SafetyNetUJC',"['NYCHA', 'TenantTuesday']",316,,C,P
7/9/19 14:47,"b'A similar study, on children in public housing high-rises above Dan Ryan Expressway in #Chicago, found that the closer their floor was to the highway, the lower their intelligence'",b'AjalovR',['Chicago'],23,,IR,N
7/9/19 14:45,b'@theaterOFpain1 @cuadrado_carol @HelloOElaine @tackettdc Obama moved people through the system and it was working quite well. Detentions with less than 72 hours. No intentional \xe2\x80\x9cdeterrence\xe2\x80\x9c were put in place by Obama. The sexual predator that lives in public housing at the White House has slowed the system has totally broken the system',b'LoriBickle',[],517,,C,EA
7/9/19 14:34,b'@OnPointRadio @CoryBooker Did Cory Booker ever live in public housing? I did.',b'tjrogers46',[],1882,,Q,F
7/9/19 14:30,b'@TStannis Several displaced residents I talked to were happy to get a voucher and return to Chicago or another city. Some did stay in Danville and some still in public housing.',b'jbaildancomnews',[],132,,PD,N
7/9/19 14:30,"b'\xe2\x80\x9cIt\xe2\x80\x99s another issue that probably should have been addressed five years ago,\xe2\x80\x9d Page said. \xe2\x80\x9cIt\xe2\x80\x99s a difficult, complex issue that has political risk to it, and (the Stenger administration) just didn\xe2\x80\x99t want to deal with it.\xe2\x80\x9d https://t.co/BBCjpjAc4q'",b'jacobbarker',[],1934,,C,EA
7/9/19 14:18,b'@Damien_English @meathcoco @meathchronicle @LMFMRADIO @RebuildingIRL @HousingPress Are they public housing',b'gerardwalshe',[],209,,IR,N
7/9/19 14:16,b'@AOC Let them learn to support themselves like most people. They should be grateful government puts roof over their head at reduced rent.  Government is not required to provide public housing but America has no choice because the same group of people has been draining America years',b'usaforeverfree',[],98,,C,EA
7/9/19 14:10,b'gotta learn how to cook in the toaster oven since our building hasn\xe2\x80\x99t had gas in weeks. \xf0\x9f\x99\x83  (public housing be like)',b'blackboikei',[],3205,,M,F
7/9/19 14:00,"b""The remarkable thing about housing debates is that this is even an issue. Some people only want to talk about gentrification or public housing or whatever else. And those issues are fine. But it's illegal to build any housing in most places. That's insane. That's gotta be first.""",b'_wayneburkett',[],157,,C,EA
7/9/19 13:57,b'Since WHEN has NYC had a MAJORITY GOP running CITY public housing? https://t.co/M54LJS76ua https://t.co/UgTN9hHsid',b'madamx12369',[],2236,,Q,F
7/9/19 13:44,"b'Vivian Bryant, president and CEO of the Orlando Housing Authority, says the authority has 1,600 public housing units (most of them in the city of Orlando.) How many people are on the waiting list for public housing? 12,000 households, almost 8 times the amount available. https://t.co/SwtUY0WSEd'",b'ChabeliH',[],3747,,Q,F
7/9/19 13:40,"b""@simon_rosenberg @mavsmum I just love the way these Nongs carry on.  We can't afford decent healthcare nor public housing or any other needs of the community but when Donny calls him up for War on the Batphone watch ScottNo stump up the cash.  He will find the wherewithal for that.""",b'alexa_jessop',[],654,,C,EA
7/9/19 13:29,"b'@SpeakerPelosi San Francisco needs a good hosing down with the filth, drugs, needles, tents ... Democrats want to rundown America like they have done in all the major cities... Democrats put American citizens in the streets and give public housing to foreigners who entered illegally.'",b'cherri_may',[],1875,,C,EA
7/9/19 13:27,"b'@the_good_matty @about_dave @sbcrosscountry @BrentGaisford If there are fewer new houses, then there are fewer commodified houses, but housing isn\xe2\x80\x99t any less commodified.   You say you are pro-housing but I don\xe2\x80\x99t see any action, or even plan, from you to build a robust public housing sector in SF or anywhere.'",b'SonjaTrauss',[],5129,,C,F
7/9/19 13:16,b'Anne Power @lsehousing @festivalofplace says the majority of new towns failed and effectively became giant public housing. Slum clearance - an attempt to get rid of awful conditions - displaced the poorest people and today\xe2\x80\x99s exclusion system was born. https://t.co/dwJWuJ3jM0',b'festivalofplace',[],442,,C,EA
7/9/19 13:16,b'Public housing found a rare but powerful advocate in @DrSamPage when Trump would like nothing more than to displace these people. https://t.co/dsnRKONipp',b'willthepinko',[],515,,C,N
7/9/19 13:15,"b'The Alton Estate is a large council estate situated in Roehampton, southwest London. One of the largest council estates (public housing) in the UK https://t.co/TgHBt88A9w'",b'fleming77',[],3600,,IR,N
7/9/19 13:13,"b'Ok, so you establish a social right to housing- with all of the public money spent in rent assistance if not full on public housing that goes with it. Great.  And what do we think will happen to land rents in areas where everyone\xe2\x80\x98s right to housing is accommodated?'",b'GeolibGeorge',[],1347,,C,EA
7/9/19 13:07,"b'There is a kind of traditionalism at work among ""YIMBYs"" or public housing advocates or any of the groups trying to build more human-scale cities and towns.'",b'jbouie',[],270774,,C,N
7/9/19 13:02,"b'Today is the last day to submit comments to the Federal Register in opposition of HUD\'s proposed rule prohibiting \xe2\x80\x9cmixed-status"" families from living in public housing &amp; Section 8 programs. https://t.co/qdHG6W7SfJ https://t.co/IkVaYuP3nv'",b'oppagenda',[],6053,,C,N
7/9/19 13:02,"b'As we consider the future of public housing in #RVA, anything other than a one-for-one replacement of units for @VibrantRRHA residents is a betrayal of the commitments made after Blackwell. Required reading from the great @__MarkRobinson. \xf0\x9f\x91\x87 https://t.co/fhoa4YDHoR'",b'JLJLovesRVA',['RVA'],276,,C,EA
7/9/19 13:00,"b'Why is HUD attacking its own proposed rule to bar illegal aliens from public housing?  While politically appointed Trump HUD officials seem to support the rule, they only constitute a small fraction of all HUD employees. Others may be undermining them. https://t.co/DlM7sl8Rkr'",b'CIS_org',[],22578,,C,N
7/9/19 13:00,"b""REMINDER: It's the last day to submit comments on a proposed new rule prohibiting families of mixed immigration status from living in public housing and Section 8 programs.  We're telling HUD this rule is wrong and harmful today. #KeepFamiliesTogether https://t.co/l0O2ilPEqR""",b'ACLUiowa',['KeepFamiliesTogether'],2532,,C,N
7/9/19 12:59,b'Demolishing public housing in Wellston may be put on hold by St. Louis County Executive https://t.co/IoXpDAaEkc via @stltoday',b'floresstl',[],571,,N,N
7/9/19 12:58,"b""In the aftermath of Stenger's indictment, guilty plea and ongoing federal investigation into it's affairs St. Louis County acting brand new again... like the new county executive and board didn't approve demolishing public housing for one of... https://t.co/bRpCSYY7KO""",b'handsupdontshoo',[],265,,C,F
7/9/19 12:57,b'@indica2007 @DallasLewis_Aus @traverselife Also how a friend got their house. It should be available to everyone who needs it. At the moment the rent goes into the pockets of someone who already has a home. The collective policies of housing as investment and subsidising private rentals has destroyed public housing.',b'JenHogben',[],308,,PD,EA
7/9/19 12:57,"b""In the aftermath of Stenger's indictment, guilty plea and ongoing federal investigation into it's affairs St. Louis County acting brand new again... like the new county executive and board didn't approve demolishing public housing for one of... https://t.co/Kzp9FUIpJm""",b'bgyrl4life',[],852,,C,F
7/9/19 12:56,"b""$30k a year on compound interest while staying in hotels and public housing is a single man's dream. Every month a budget $2,500.  No need to stress. Let me show you how it works. Send $20 right now and get your consultation phone call.""",b'DoinThangz',[],3630,,IR,N
7/9/19 12:40,b'Glad the Vic gov understands the need for public housing. I was worried they were selling it off to developers in favour of prisons and the Salvos without getting what they were doing. https://t.co/qCm9uGZqjv',b'1312Allenby',[],39,,IR,S
7/9/19 12:40,"b'@RonnyMcGinley @Brasilmagic more like the Rump Hotels version of public housing, but fair'",b'GreatScot_ish',[],164,,IR,S
7/9/19 12:38,b'@DallasLewis_Aus @JenHogben @traverselife im just descibing what public housing was always ment to be we where never ment to rent for life its how mum got her home why im not homeless i live in my bedroom at mums house',b'indica2007',[],3047,,E,F
7/9/19 12:34,b'@AOC If only some big company would open up in NYC and add 25k jobs...maybe some of these people could get out of public housing....',b'Jenniferalbail',[],272,,C,F
7/9/19 12:31,"b""@Nate_McMurray You learn alot living down here on the border, some of these ilegals, not gonna lie, they're awesome hustlers! I'm a bit jealous, public housing, under the table jobs! Like and these jobs pay like 15, 16 an hour, no taxes pulled! Then they like be in public housing! True hustlers""",b'BLH4House',[],251,,C,EA
7/9/19 12:28,"b""@Jason_Gregory_ How TAF can anyone put a positive spin on homelessness? Emergency accommodation is desperately needed &amp; public housing is equally urgent. Can't believe the simpleton Howarth can't imagine how terrifying it must be not to have a home to rest your head, especially during winter.""",b'janer98',[],2014,,E,EA
7/9/19 12:23,b'@samantha3050 @NYCTSubway because robert moses wanted roads and more roads and public housing to horde poor folk into certain areas',b'repub9989',[],4674,,C,F
7/9/19 12:20,b'Confiscate Jeff Epstein\xe2\x80\x99s giant ridiculous mansion and turn it into public housing for victims of sexual assault.',b'DrBrutusPowers',[],785,,IR,EA
7/9/19 12:17,"b'Waiting years for public housing and this ignorant federal minister says there is no housing crisis, that bullshit https://t.co/jVRbq9PZNZ'",b'richardmelb05',[],297,,C,EA
7/9/19 12:09,"b""@williondollars So frustrating. We need to build more public housing. And it needs to be properly maintained. But capitalism hates taking care of anything that isn't profitable. -_-""",b'FickleHarpy',[],481,,C,F
7/9/19 12:02,b'Call it public housing when you\xe2\x80\x99re next door to them killers',b'Tyler_Pride3',[],1360,,IR,EA
7/9/19 12:01,"b'HUD wants to bar \xe2\x80\x9cmixed status\xe2\x80\x9d immigrants from it\xe2\x80\x99s public housing. You can comment directly here: https://t.co/pqTgA9K3gi  You know what to do, Twitter!'",b'MDHillRaiser',[],3671,,C,F
7/9/19 11:57,"b'@blvckfonzz @Carolkry @AtonB117 @IamJohnBurnett @angelvanstark @MJtheProphet @AOC @SecretaryCarson @LynnePattonHUD For decades, republicans have cut funding to public housing. Again, Trump will be gutting the funding to HUD. NYCHA projects will only get worse. Stop voting for the GOP.'",b'jalal_moeen',[],36,,PD,EA
7/9/19 11:47,"b'@marklutchman Yes !  Outlaw sanctuary cities, counties, &amp; states. Stop public housing, welfare, medical care, college tuition !  Stop the freebies !\xc2\xa0 Make it less appealing to come here.\xc2\xa0 Americans First now &amp; forever\xc2\xa0 !'",b'Stargazer4509',[],60,,C,EA
7/9/19 11:47,b'Demolishing public housing in Wellston may be put on hold by St. Louis County Executive https://t.co/UjgDxADbVH',b'TheSTLScoop',[],10535,,N,N
7/9/19 11:42,b'A lot of y\xe2\x80\x99all in public housing on here acting like you maneuvering',b'PeasPolo84',[],97,,C,EA
